<?xml version="1.0" encoding="UTF-8"?>
<tns:UserProfile xmlns:tns="http://www.example.org/Profil" xmlns:xsi="http://www.w3.org/2001/XMLSchema-instance" xsi:schemaLocation="http://www.example.org/Profil Profile.xsd ">
  <tns:UserID>0</tns:UserID>
  <tns:UserName>tns:UserName</tns:UserName>
  <tns:UserInformation>
    <tns:FirstName>tns:FirstName</tns:FirstName>
    <tns:LastName>tns:LastName</tns:LastName>
    <tns:Age>0</tns:Age>
    <tns:City>tns:City</tns:City>
  </tns:UserInformation>
  <tns:Subscriptions>
    <tns:ChannelName/>
  </tns:Subscriptions>
</tns:UserProfile>
